<?xml version="1.0"?>
<xs:schema elementFormDefault="qualified" xmlns:xs="http://www.w3.org/2001/XMLSchema">

    <xs:simpleType name="tipoAltura">
        <xs:restriction base="xs:decimal">
            <xs:minExclusive value="0"/>
        </xs:restriction>
    </xs:simpleType>
   
    <xs:simpleType name="unidadMedidaTipo">
        <xs:restriction base="xs:string">
            <xs:enumeration value="m"/>
            <xs:enumeration value="f"/>
        </xs:restriction>
    </xs:simpleType>

    <xs:simpleType name="nombreMayuscula">
        <xs:restriction base="xs:string">
            <xs:pattern value="[A-Z].*"/>
        </xs:restriction>
    </xs:simpleType>
        
    <xs:element name="cadenas-montanyosas">
        <xs:complexType>
            <xs:sequence>
                <xs:element name="cadena-montanyosa" minOccurs="1" maxOccurs="unbounded">
                    <xs:complexType>
                        <xs:sequence>                                                        
                            <xs:element name="montanya" maxOccurs="unbounded" minOccurs="1">
                                <xs:complexType>
                                    <xs:sequence>
                                        <xs:element name="nombre" type="xs:string"/>
                                        <xs:element name="region" type="xs:string"/>
                                        <xs:element name="altura">
                                            <xs:complexType>
                                                <xs:simpleContent>
                                                    <xs:extension base="tipoAltura">
                                                        <xs:attribute name="unidad-medida" type="unidadMedidaTipo" use="optional"/>
                                                    </xs:extension>
                                                </xs:simpleContent>
                                            </xs:complexType>
                                        </xs:element>
                                    </xs:sequence>
                                </xs:complexType>
                            </xs:element>    
                        </xs:sequence>
                        <xs:attribute name="nombre" type="nombreMayuscula" use="required"/>
                    </xs:complexType>
                </xs:element>
            </xs:sequence>
        </xs:complexType>
    </xs:element>
</xs:schema>

