<?xml version="1.0" encoding="UTF-8"?>
<cadenas-montanyosas xmlns:xsi="http://www.w3.org/2001/XMLSchema-instance" xsi:noNamespaceSchemaLocation="Cadenas.xsd">
  <cadena-montanyosa nombre="Pirineos">
    <montanya>
      <nombre>Pico Aneto</nombre>
      <region>Maladeta-Aneto</region>
      <altura unidad-medida="m">3404</altura>
    </montanya>
    <montanya>
      <nombre>Sierra Morena</nombre>
      <region>La Múnia</region>
      <altura unidad-medida="m">3090</altura>
    </montanya>
  </cadena-montanyosa>
  <cadena-montanyosa nombre="Sierra Nevada">
    <montanya>
      <nombre>Mulhacén</nombre>
      <region>Sierra norte</region>
      <altura unidad-medida="m">3480</altura>
    </montanya>
    <montanya>
      <nombre>Cartujo</nombre>
      <region>Sierra sur</region>
      <altura unidad-medida="m">3152</altura>
    </montanya>
  </cadena-montanyosa>
</cadenas-montanyosas>
